{
  "dataset_name": "telco_churn_sample",
  "row_count": 10000,
  "sampled_row_count": 5000,
  "sampling_ratio": 0.5,
  "column_count": 21,
  "generated_at": "2025-11-21T15:36:58.848048Z",
  "columns": [
    {
      "name": "customerID",
      "semantic_type": "categorical",
      "null_count": 0,
      "null_pct": 0.0,
      "distinct_count": 5000,
      "example": "6252-1158",
      "numeric_stats": null,
      "categorical_stats": {
        "top_values": [
          {
            "value": "6252-1158",
            "count": 1,
            "percent": 0.02
          },
          {
            "value": "4684-9308",
            "count": 1,
            "percent": 0.02
          },
          {
            "value": "1731-7250",
            "count": 1,
            "percent": 0.02
          },
          {
            "value": "4742-6447",
            "count": 1,
            "percent": 0.02
          },
          {
            "value": "4521-1417",
            "count": 1,
            "percent": 0.02
          }
        ]
      }
    },
    {
      "name": "gender",
      "semantic_type": "categorical",
      "null_count": 0,
      "null_pct": 0.0,
      "distinct_count": 2,
      "example": "Male",
      "numeric_stats": null,
      "categorical_stats": {
        "top_values": [
          {
            "value": "Female",
            "count": 2561,
            "percent": 51.22
          },
          {
            "value": "Male",
            "count": 2439,
            "percent": 48.78
          }
        ]
      }
    },
    {
      "name": "SeniorCitizen",
      "semantic_type": "numeric",
      "null_count": 0,
      "null_pct": 0.0,
      "distinct_count": 2,
      "example": "1",
      "numeric_stats": {
        "min": 0.0,
        "max": 1.0,
        "mean": 0.4902,
        "stddev": 0.499953948669433,
        "p05": 0.0,
        "p95": 1.0
      },
      "categorical_stats": null
    },
    {
      "name": "Partner",
      "semantic_type": "categorical",
      "null_count": 0,
      "null_pct": 0.0,
      "distinct_count": 2,
      "example": "Yes",
      "numeric_stats": null,
      "categorical_stats": {
        "top_values": [
          {
            "value": "No",
            "count": 2514,
            "percent": 50.28
          },
          {
            "value": "Yes",
            "count": 2486,
            "percent": 49.72
          }
        ]
      }
    },
    {
      "name": "Dependents",
      "semantic_type": "categorical",
      "null_count": 0,
      "null_pct": 0.0,
      "distinct_count": 2,
      "example": "No",
      "numeric_stats": null,
      "categorical_stats": {
        "top_values": [
          {
            "value": "No",
            "count": 2548,
            "percent": 50.96
          },
          {
            "value": "Yes",
            "count": 2452,
            "percent": 49.04
          }
        ]
      }
    },
    {
      "name": "tenure",
      "semantic_type": "numeric",
      "null_count": 0,
      "null_pct": 0.0,
      "distinct_count": 73,
      "example": "24",
      "numeric_stats": {
        "min": 0.0,
        "max": 72.0,
        "mean": 35.97,
        "stddev": 21.11820768292489,
        "p05": 3.0,
        "p95": 69.0
      },
      "categorical_stats": null
    },
    {
      "name": "PhoneService",
      "semantic_type": "categorical",
      "null_count": 0,
      "null_pct": 0.0,
      "distinct_count": 2,
      "example": "Yes",
      "numeric_stats": null,
      "categorical_stats": {
        "top_values": [
          {
            "value": "Yes",
            "count": 2501,
            "percent": 50.02
          },
          {
            "value": "No",
            "count": 2499,
            "percent": 49.98
          }
        ]
      }
    },
    {
      "name": "MultipleLines",
      "semantic_type": "categorical",
      "null_count": 0,
      "null_pct": 0.0,
      "distinct_count": 3,
      "example": "No",
      "numeric_stats": null,
      "categorical_stats": {
        "top_values": [
          {
            "value": "Yes",
            "count": 1699,
            "percent": 33.98
          },
          {
            "value": "No",
            "count": 1660,
            "percent": 33.2
          },
          {
            "value": "No phone service",
            "count": 1641,
            "percent": 32.82
          }
        ]
      }
    },
    {
      "name": "InternetService",
      "semantic_type": "categorical",
      "null_count": 0,
      "null_pct": 0.0,
      "distinct_count": 3,
      "example": "DSL",
      "numeric_stats": null,
      "categorical_stats": {
        "top_values": [
          {
            "value": "Fiber optic",
            "count": 1692,
            "percent": 33.84
          },
          {
            "value": "No",
            "count": 1672,
            "percent": 33.44
          },
          {
            "value": "DSL",
            "count": 1636,
            "percent": 32.72
          }
        ]
      }
    },
    {
      "name": "OnlineSecurity",
      "semantic_type": "categorical",
      "null_count": 0,
      "null_pct": 0.0,
      "distinct_count": 3,
      "example": "No",
      "numeric_stats": null,
      "categorical_stats": {
        "top_values": [
          {
            "value": "No internet service",
            "count": 1722,
            "percent": 34.44
          },
          {
            "value": "No",
            "count": 1649,
            "percent": 32.98
          },
          {
            "value": "Yes",
            "count": 1629,
            "percent": 32.58
          }
        ]
      }
    },
    {
      "name": "OnlineBackup",
      "semantic_type": "categorical",
      "null_count": 0,
      "null_pct": 0.0,
      "distinct_count": 3,
      "example": "No",
      "numeric_stats": null,
      "categorical_stats": {
        "top_values": [
          {
            "value": "No internet service",
            "count": 1682,
            "percent": 33.64
          },
          {
            "value": "Yes",
            "count": 1660,
            "percent": 33.2
          },
          {
            "value": "No",
            "count": 1658,
            "percent": 33.16
          }
        ]
      }
    },
    {
      "name": "DeviceProtection",
      "semantic_type": "categorical",
      "null_count": 0,
      "null_pct": 0.0,
      "distinct_count": 3,
      "example": "No internet service",
      "numeric_stats": null,
      "categorical_stats": {
        "top_values": [
          {
            "value": "No internet service",
            "count": 1687,
            "percent": 33.74
          },
          {
            "value": "Yes",
            "count": 1681,
            "percent": 33.62
          },
          {
            "value": "No",
            "count": 1632,
            "percent": 32.64
          }
        ]
      }
    },
    {
      "name": "TechSupport",
      "semantic_type": "categorical",
      "null_count": 0,
      "null_pct": 0.0,
      "distinct_count": 3,
      "example": "No internet service",
      "numeric_stats": null,
      "categorical_stats": {
        "top_values": [
          {
            "value": "No internet service",
            "count": 1706,
            "percent": 34.12
          },
          {
            "value": "Yes",
            "count": 1682,
            "percent": 33.64
          },
          {
            "value": "No",
            "count": 1612,
            "percent": 32.24
          }
        ]
      }
    },
    {
      "name": "StreamingTV",
      "semantic_type": "categorical",
      "null_count": 0,
      "null_pct": 0.0,
      "distinct_count": 3,
      "example": "No internet service",
      "numeric_stats": null,
      "categorical_stats": {
        "top_values": [
          {
            "value": "No",
            "count": 1690,
            "percent": 33.8
          },
          {
            "value": "Yes",
            "count": 1665,
            "percent": 33.3
          },
          {
            "value": "No internet service",
            "count": 1645,
            "percent": 32.9
          }
        ]
      }
    },
    {
      "name": "StreamingMovies",
      "semantic_type": "categorical",
      "null_count": 0,
      "null_pct": 0.0,
      "distinct_count": 3,
      "example": "Yes",
      "numeric_stats": null,
      "categorical_stats": {
        "top_values": [
          {
            "value": "Yes",
            "count": 1700,
            "percent": 34.0
          },
          {
            "value": "No",
            "count": 1668,
            "percent": 33.36
          },
          {
            "value": "No internet service",
            "count": 1632,
            "percent": 32.64
          }
        ]
      }
    },
    {
      "name": "Contract",
      "semantic_type": "categorical",
      "null_count": 0,
      "null_pct": 0.0,
      "distinct_count": 3,
      "example": "Two year",
      "numeric_stats": null,
      "categorical_stats": {
        "top_values": [
          {
            "value": "One year",
            "count": 1687,
            "percent": 33.74
          },
          {
            "value": "Two year",
            "count": 1679,
            "percent": 33.58
          },
          {
            "value": "Month-to-month",
            "count": 1634,
            "percent": 32.68
          }
        ]
      }
    },
    {
      "name": "PaperlessBilling",
      "semantic_type": "categorical",
      "null_count": 0,
      "null_pct": 0.0,
      "distinct_count": 2,
      "example": "Yes",
      "numeric_stats": null,
      "categorical_stats": {
        "top_values": [
          {
            "value": "No",
            "count": 2516,
            "percent": 50.32
          },
          {
            "value": "Yes",
            "count": 2484,
            "percent": 49.68
          }
        ]
      }
    },
    {
      "name": "PaymentMethod",
      "semantic_type": "categorical",
      "null_count": 0,